index,Country,Confucius Institute,Location,Status
525,United States,Confucius Institute at Alabama A&M University,alabama a&m university,Closed
526,United States,Confucius Institute at Temple University,temple university,Closed
527,United States,Confucius Institute at West Virginia University,west virginia university,Closed
528,United States,Confucius Institute at Southern Utah University,southern utah university,Closed
529,United States,Confucius Institute at New Jersey City University,new jersey city university,Closed
530,United States,Confucius Institute at Clark County School District,clark county school district,Closed
531,United States,Confucius Institute at Davis School Disrict,davis school disrict,Closed
532,United States,Confucius Institute at Savannah State University,savannah state university,Closed
533,United States,"Confucius Institute at the University of California, Santa Barbara","the university of california, santa barbara",Closed
534,United States,Confucius Institute at Northwest Nazarene University,northwest nazarene university,Closed
535,United States,Confucius Institute at the University of North Carolina at Charlotte,the university of north carolina at charlotte,Closed
536,United States,New York Confucius Institute for Global Finance at Baruch College,baruch college,Closed
537,United States,Confucius Institute at Medga Evers College The City University of New York,medga evers college the city university of new york,Closed
538,United States,Confucius Institute of Western Kentucky,"Kentucky, United States",Closed
539,United States,Confucius Institute in San Diego at San Diego Global Educational Institute,san diego global educational institute,Closed
540,United States,Miami Confucius Institute for Business,"Miami, United States",Closed
541,Uruguay,"Confucius Institute at the Universidad de la Republica, Uruguay","the universidad de la republica, uruguay",Closed
542,Uzbekistan,Confucius Institute in Tashkent State Institute of Oriental Studies,Tashkent State Institute,Closed
543,Uzbekistan,Confucius Institute at Samarkand State Institute of Foreign Languages,samarkand state institute of foreign languages,Open
544,Venezuela,Confucius Institute at Universidad Bolivariana de Venezuela,universidad bolivariana de venezuela,Closed
545,Venezuela,Confucius Institute at the Bolivarian University of Venezuela in Caracas,the bolivarian university of venezuela in caracas,Closed
546,Vietnam,Confucius Institute at Hanoi University,hanoi university,Closed
547,Zambia,Confucius Institute at University of Zambia,university of zambia,Closed
548,Zimbabwe,Confucius Institute at the University of Zimbabwe,the university of zimbabwe,Closed
